{
  "schemaVersion": 1,
  "storyId": "demon-king",
  "storyVersion": "1.1.0",
  "nodes": {
    "dk20_after_attack_confession": {
      "chronicleSummary": "살해 시도 직후 미나에게 고백했지만, 경비병에게 결박된 채 체포 절차를 밟았다."
    },
    "dk20_disarmed": {
      "chronicleSummary": "미나를 공격하려다 무장을 해제당했다. 그녀가 나를 보는 눈빛이 달라졌다.",
      "locationLabel": "왕립 용사 시험장",
      "dialogues": [
        {
          "speaker": "미나",
          "text": "왜 진짜로 찌르려 한 거야? 내가 피하지 않았으면?"
        },
        {
          "speaker": "가짜 마왕",
          "text": "성공하면 네 힘을 얻을 줄 알았지."
        },
        {
          "speaker": "미나",
          "text": "그걸 지금 설명이라고 하고 있는 거야?"
        },
        {
          "speaker": "시험관",
          "text": "시험은 잠시 중단합니다. 용사보다 피고인이 먼저 나올 것 같습니다."
        }
      ]
    },
    "dk20_escape": {
      "chronicleSummary": "마왕 등록증을 버리고 시험장에서 도망쳤다. 미나가 추격했다."
    },
    "dk20_exam": {
      "chronicleSummary": "소꿉친구 미나의 용사 시험 날, 전투력 2인 내가 공식 토벌 대상 마왕으로 지정됐다.",
      "locationLabel": "왕립 용사 시험장",
      "dialogues": [
        {
          "speaker": "시험관",
          "text": "등록번호 확인. 마왕님, 전투력은... 2군요. 숫자가 빠진 건 아니죠?"
        },
        {
          "speaker": "가짜 마왕",
          "text": "아뇨. 마력도 0입니다. 이러면 시험을 취소해야 하는 거 아닙니까?"
        },
        {
          "speaker": "미나",
          "text": "취소하면 난 또 일 년을 기다려야 해. 그러니까 가만히만 있어."
        },
        {
          "speaker": "시험관",
          "text": "서로 합의하셨다면 부디 크게 다치지 않는 방향으로 부탁드립니다."
        }
      ]
    },
    "dk20_fraud_pitch": {
      "chronicleSummary": "미나에게 가짜 토벌극을 제안했다. 시험 조작이 들킬 위험이 있었다.",
      "locationLabel": "왕립 용사 시험장",
      "dialogues": [
        {
          "speaker": "가짜 마왕",
          "text": "내가 쓰러진 척하면 넌 용사가 되고, 난 살아남아. 모두 좋지?"
        },
        {
          "speaker": "미나",
          "text": "합격하면 내 가족 빚을 갚을 수 있어."
        },
        {
          "speaker": "가짜 마왕",
          "text": "그럼 거래 성립?"
        },
        {
          "speaker": "미나",
          "text": "들키면 난 자격을 잃어. 네 계산서에 그 항목도 넣어."
        }
      ]
    },
    "dk20_legal_protest": {
      "chronicleSummary": "용사 시험장에서 마왕의 국민 권리를 주장하며 공식 민원을 요청했다.",
      "locationLabel": "왕립 용사 시험장",
      "dialogues": [
        {
          "speaker": "가짜 마왕",
          "text": "국민을 죽여야 합격한다는 시험이 어디 있습니까?"
        },
        {
          "speaker": "시험 감독관",
          "text": "원래 토벌 대상이 국민인 경우를 예상하지 않았습니다."
        },
        {
          "speaker": "미나",
          "text": "시험을 망치고 싶진 않지만, 이 문제는 네 말이 맞아."
        },
        {
          "speaker": "시험 감독관",
          "text": "그럼 민원서류부터 작성하겠습니다. 토벌은 일단 보류하고요."
        }
      ]
    },
    "dk20_public_confession": {
      "chronicleSummary": "용사 시험 중 미나에게 사랑을 고백했다. 시험관도 당황했다.",
      "locationLabel": "왕립 용사 시험장",
      "dialogues": [
        {
          "speaker": "가짜 마왕",
          "text": "미나, 사실 예전부터 널 좋아했어."
        },
        {
          "speaker": "미나",
          "text": "지금? 내 국가고시 시험장에서?"
        },
        {
          "speaker": "시험관",
          "text": "개인적 고백은 시험 성적에 반영되지 않습니다."
        },
        {
          "speaker": "미나",
          "text": "그걸 굳이 공식 발표하실 필요는 없었는데요."
        }
      ]
    },
    "dk21_assault_trial": {
      "chronicleSummary": "미나 공격 사건으로 재판을 받았다. 목격자 여섯 명이 법정에 섰다.",
      "locationLabel": "왕립 법원",
      "dialogues": [
        {
          "speaker": "판사",
          "text": "피고인, 미나의 전투력이 8,402라는 사실을 알고 있었습니까?"
        },
        {
          "speaker": "가짜 마왕",
          "text": "예. 하지만 저는 등록 마왕입니다."
        },
        {
          "speaker": "판사",
          "text": "마왕은 직업이 아닙니다. 살인미수는 더더욱 직무가 아니고요."
        },
        {
          "speaker": "검사",
          "text": "전투력의 차이는 범행 의도를 없애주지 않습니다."
        }
      ]
    },
    "dk21_clean_detention": {
      "chronicleSummary": "중범죄 혐의는 없지만 등록 마왕 관리 규정에 따라 정기 출석 요구를 받았다."
    },
    "dk21_fraud_caught": {
      "chronicleSummary": "가짜 토벌극이 들켜 미나의 시험이 보류됐고, 내게도 혐의가 생겼다."
    },
    "dk21_fraud_success": {
      "chronicleSummary": "미나는 용사 자격증을 받았고, 살아 있는 나는 사망 신고를 취소하러 갔다."
    },
    "dk21_rights_hearing": {
      "chronicleSummary": "미나와 함께 토벌 시험 제도에 대한 소규모 공청회에 참석했다."
    },
    "dk21_street_activist": {
      "chronicleSummary": "우체국 앞 벤치에서 마왕 공화국을 선포했다가 무단 점유 과태료가 쌓였다."
    },
    "dk22_fake_hero_business": {
      "chronicleSummary": "용사 시험 수요를 노린 유료 마왕 대여 제안이 이어졌다."
    },
    "dk22_fraud_press": {
      "chronicleSummary": "허위 토벌 사건이 신문에 실렸다. 미나에게 징계나 재시험 가능성이 생겼다."
    },
    "dk22_prison": {
      "chronicleSummary": "3년 형을 살던 감옥에서 미나가 면회를 왔다. 나는 규정상 독방 수용 중이었다.",
      "locationLabel": "왕립 감옥 · 면회실",
      "dialogues": [
        {
          "speaker": "미나",
          "text": "면회 신청서에 관계를 '오랜 친구'라고 썼더라."
        },
        {
          "speaker": "가짜 마왕",
          "text": "틀린 말은 아니잖아."
        },
        {
          "speaker": "미나",
          "text": "맞아. 그렇다고 네가 한 일이 없어지는 것도 아니야."
        },
        {
          "speaker": "교도관",
          "text": "면회 시간은 십 분입니다. 세계정복 논의는 다음 기회에 하십시오."
        }
      ]
    },
    "dk22_road_show": {
      "chronicleSummary": "거리 공연단에서 전투력 2인 마왕 역할이 인기 공연이 됐다."
    },
    "dk23_prison_book": {
      "chronicleSummary": "출판 계약이 무산됐다. 감옥 문서실에서 수상한 마왕 예산 분류를 보았다."
    },
    "dk23_release_excon": {
      "chronicleSummary": "형기를 마치고 출소했지만, 전과와 마왕 등록 때문에 취업이 쉽지 않았다."
    },
    "dk24_borderland": {
      "chronicleSummary": "이웃 왕국에서 마왕 등록증이 관광상품처럼 취급돼 국경 서점에서 일하게 됐다."
    },
    "dk24_excon_restart": {
      "chronicleSummary": "출소 후 다시 취업을 시도하던 중 왕녀 에리시아의 비밀 초청장을 받았다."
    },
    "dk24_merchant_start": {
      "chronicleSummary": "시장에서 마왕 관련 장사를 시작하려 했지만 무엇을 파는지 설명하기도 어려웠다."
    },
    "dk24_mina_break": {
      "chronicleSummary": "미나가 자신의 이름을 이용하지 말라는 마지막 편지를 보냈다."
    },
    "dk24_rights_start": {
      "chronicleSummary": "왕국에는 마왕 상담소가 없다는 사실을 확인하고 권익 문제를 고민했다."
    },
    "dk25_civic_election": {
      "chronicleSummary": "선거 후보 명단의 '마왕(현직)' 표시를 두고 선관위가 심사했다."
    },
    "dk25_forged_risk": {
      "chronicleSummary": "마왕의 위력을 과장한 위험 보고서를 작성했고 보험 판매자가 관심을 보였다."
    },
    "dk25_hero_centre": {
      "chronicleSummary": "용사단 훈련장에서 정식 병사도 아닌 훈련용 마왕 모델로 분류됐다.",
      "locationLabel": "왕립 용사단 훈련장",
      "dialogues": [
        {
          "speaker": "훈련 교관",
          "text": "모형 2호, 정해진 선 안에 서십시오."
        },
        {
          "speaker": "가짜 마왕",
          "text": "제 이름을 부르면 안 됩니까? 전 살아 있는데요."
        },
        {
          "speaker": "훈련 교관",
          "text": "인간 이름으로 된 훈련 장비 관리표가 없습니다."
        },
        {
          "speaker": "가짜 마왕",
          "text": "그럼 먼저 관리표부터 고쳐 주세요."
        }
      ]
    },
    "dk25_low_road": {
      "chronicleSummary": "평범한 일을 하며 월세와 장부를 맞췄다. 마왕 이름보다 생활비가 무거웠다."
    },
    "dk25_newsroom": {
      "chronicleSummary": "기자의 과장된 기사 때문에 내 주민등록 문제는 왕국 전복 음모로 보도됐다.",
      "locationLabel": "왕국 신문사",
      "dialogues": [
        {
          "speaker": "기자",
          "text": "전설의 마왕님, 가장 무서운 무기가 뭡니까?"
        },
        {
          "speaker": "가짜 마왕",
          "text": "주민등록 정정 신청서요. 담당자가 매번 바뀝니다."
        },
        {
          "speaker": "기자",
          "text": "왕국을 흔드는 비밀 문서를 보유하셨군요."
        },
        {
          "speaker": "가짜 마왕",
          "text": "방금 제 말을 들으신 거 맞아요?"
        }
      ]
    },
    "dk25_princess_meeting": {
      "chronicleSummary": "에리시아 왕녀가 마왕 관리 예산을 문제 삼으며 내 이름을 정치적 자산으로 보았다.",
      "locationLabel": "왕녀의 비밀 회의실",
      "dialogues": [
        {
          "speaker": "에리시아",
          "text": "당신의 전투력은 관심 없습니다. 장부에 찍힌 마왕이라는 글자가 중요해요."
        },
        {
          "speaker": "가짜 마왕",
          "text": "처음으로 제 이름을 알아봐 주시는 분이군요."
        },
        {
          "speaker": "에리시아",
          "text": "알아보는 것과 존경하는 것은 다릅니다."
        },
        {
          "speaker": "가짜 마왕",
          "text": "그럼 사용료를 청구해도 되는 사이입니까?"
        }
      ]
    },
    "dk25_princess_reply": {
      "chronicleSummary": "에리시아가 내 청혼은 거절했지만 정치적 활용 가능성은 남겨뒀다."
    },
    "dk25_rights_union": {
      "chronicleSummary": "회원 한 명짜리 마왕 권익단체를 만들고 스스로 의장에 당선됐다."
    },
    "dk25_theme_park": {
      "chronicleSummary": "마왕 체험관을 열었지만 하루 수입 30금화보다 운영비 42금화가 더 컸다."
    },
    "dk26_budget_tip": {
      "chronicleSummary": "마왕 관리 예산이 비정상적으로 크다는 제보를 들었지만 공개 장부는 가려져 있었다."
    },
    "dk26_contract_negotiation": {
      "chronicleSummary": "왕국이 내 마왕 명칭을 홍보에 사용하지만 사용료 계약은 비어 있음을 확인했다."
    },
    "dk26_mina_professional": {
      "chronicleSummary": "미나와 공개된 업무 자리에서 용사 시험 개혁을 논의했다.",
      "locationLabel": "용사 시험 개정 회의실",
      "dialogues": [
        {
          "speaker": "미나",
          "text": "오늘은 시험 안전규정만 이야기해."
        },
        {
          "speaker": "가짜 마왕",
          "text": "용사 시험에 피험자 동의서가 없다는 건 확실히 이상하네."
        },
        {
          "speaker": "미나",
          "text": "그래. 그 문제라면 네 증언이 필요해."
        },
        {
          "speaker": "가짜 마왕",
          "text": "좋아. 사생활 이야기와 업무 이야기는 구별할게."
        }
      ]
    },
    "dk26_palace_informant": {
      "chronicleSummary": "국왕의 비서관에게 왕녀 관련 제보를 했지만 특별한 보상은 없었다."
    },
    "dk26_princess_camp": {
      "chronicleSummary": "에리시아의 정치 진영에서 귀족회의 개혁안을 작성하게 됐다."
    },
    "dk26_royal_scandal": {
      "chronicleSummary": "마왕 소동이 신문에 났지만 댓글의 절반 이상을 내가 직접 썼다."
    },
    "dk26_village_life": {
      "chronicleSummary": "국경 마을에서 농사를 도우며 마왕 대신 이웃 일손으로 살아봤다."
    },
    "dk26_workers_claim": {
      "chronicleSummary": "훈련용 마왕에게 적용할 급여 기준 자체가 없다는 사실을 알았다."
    },
    "dk27_budget_first_trace": {
      "chronicleSummary": "마왕 관리사업의 큰 예산과 일부 이체 기록을 보았다. 지출 목적은 아직 밝혀지지 않았다."
    },
    "dk27_calm_years": {
      "chronicleSummary": "세금과 월세를 내며 평범하게 살았다. 세계정복은 옛 농담이 됐다."
    },
    "dk27_erisia_distance": {
      "chronicleSummary": "에리시아는 내 청혼과 계약은 별개라 선을 그었고, 비밀 예산 추정표를 갖고 있었다."
    },
    "dk27_insurance_empire": {
      "chronicleSummary": "마왕 공포를 파는 보험 사업이 커졌지만 약관을 오해한 고객이 많았다."
    },
    "dk27_local_office": {
      "chronicleSummary": "지역위원 역할을 맡았더니 첫 민원은 세계정복이 아닌 하수구였다."
    },
    "dk27_mina_reunion": {
      "chronicleSummary": "용사단 간부가 된 미나와 재회했다. 그녀는 사적인 관계보다 업무 구분을 원했다."
    },
    "dk27_royal_banquet": {
      "chronicleSummary": "왕실 행사에 참석했다. 국왕과 에리시아, 경호 중인 미나를 마주쳤다.",
      "locationLabel": "왕궁 연회장",